objectName,English,French
ttp_loctToFile,Save the Current Coordinate to the Selected File(s),Copie positions dans le(s) fichier(s) selectionné(s)
ttp_NavigateMapGo,Put Coordinates of Selected Files onto the Map,Placer les coordonnées des fichiers sélectionnés sur la carte
ttp_OffsetTime,"Time Zones are left as blank on open regardless of what the stored value is. There is no Exif Tag for TZ but only 'Offset', which is something like '+01:00'. As there is no indication for neither TZ nor DST per se I can't ascertain that  '+01:00' was in fact say BST rather than CET, one being DST the other not. Either adjust manually or pull from web - the combination of coordinates + createDate would decisively inform the program of the real TZ value. The value in the read-only textbox will be saved in the file.","Les time zones sont laissées vides à l'ouverture quelles que soient lesvaleurs stockées. Il by a pas de tag Exif pour TZ mais seulement un offset ressemblant à +01:00, Comme il n'y a aucune indication ni pour TZ ni pour l'heure d'été/hivers, on ne peut savoir ce que signifie ce +01:00 qui peut etre BST ou CET ou heure d'ete/hivers. Lors du reglage manuel ou à partir du web, c'est la combinaison localisation et date de creation qui decideront de la vraie valeur du parametre TZ. La valeur en lecture seule sera sauvée dans le fichier."
ttp_SaveFavourite,Save (or overwrite) the currently selected file's metadata to your Favourites,Sauver ou modifier les metadata des fichiers selectionnés dans vos favoris
ttp_LoadFavourite,Load metadata for the selected file(s) from your Favourites,Recharger les metadata des fichiers selectionnés depuis vos favoris
ttp_ManageFavourites,Manage Favourites,
ttp_loctToFileDestination,Save the Current Coordinate to the Selected Files' Destination,
ttp_GPSDataPaste,"Press CTRL+V to paste a valid pair of decimals to the lat/long placeholders. 
The clipboard should contain only a pair of decimals, preferably in ""invariant"" (English) setup, which is integer-dot-decimal-comma-integer-dot-decimal, such as 12.345, 56.897
That said the code _should_ be able to comprehend other layouts. Note if the clipboard has anything apart from the above the operation will fail (nothing will happen.)",
